{
  "program_id": "add",
  "task_id": "add_i32",
  "split": "train",
  "z": [
    0.5262029757723212,
    0.977237946819514,
    0.9606273244135082,
    -0.6450440972112119,
    -0.7952113929204643,
    -0.5956111839041114,
    0.8693535383790731,
    -0.19312341278418899,
    -0.05778025649487972,
    -0.09199472423642874,
    -0.04828873369842768,
    0.39110799552872777,
    0.38882711436599493,
    0.7899370798841119,
    -0.36879861541092396,
    0.5219166940078139,
    0.6279836427420378,
    0.8938896786421537,
    -0.20503352582454681,
    0.17662764294072986,
    0.32609259709715843,
    0.9228118164464831,
    0.6655216254293919,
    0.7325436370447278,
    0.424256491009146,
    -0.7793690827675164,
    0.1278833905234933,
    -0.02800353616476059,
    -0.8183720363304019,
    -0.35112027870491147,
    0.6423484073020518,
    0.915683631785214,
    -0.5860117352567613,
    0.8642700165510178,
    -0.2676603780128062,
    -0.7832522103562951,
    -0.9381870804354548,
    -0.83703229483217,
    -0.8952243570238352,
    -0.5750387911684811,
    -0.17529665073379874,
    -0.5603688885457814,
    0.23319292906671762,
    0.38196559017524123,
    0.32276860158890486,
    0.9626305717974901,
    -0.21627238858491182,
    0.37889466620981693,
    -0.15204900689423084,
    -0.35281943110749125,
    0.3796065840870142,
    -0.11023397883400321,
    0.70796057023108,
    0.811398311983794,
    -0.4238992207683623,
    -0.36203587520867586,
    -0.035593497566878796,
    -0.5392863089218736,
    0.13035396300256252,
    -0.016587069258093834,
    0.38537587644532323,
    -0.6262038969434798,
    -0.547438673209399,
    -0.3445282303728163,
    0.09400339843705297,
    0.48251770762726665,
    0.7109640701673925,
    0.06545559968799353,
    -0.7652919255197048,
    0.32415154203772545,
    -0.975111179985106,
    -0.9286248600110412,
    0.6725749145261943,
    -0.408110951539129,
    0.7586999167688191,
    0.06055036885663867,
    0.49066298361867666,
    0.4181508291512728,
    -0.5100542241707444,
    0.8638926935382187,
    0.7314102174714208,
    -0.4259972721338272,
    -0.8251211792230606,
    0.7829453833401203,
    -0.1596466852352023,
    -0.5033353278413415,
    0.37385684670880437,
    0.30463557597249746,
    0.1666442728601396,
    -0.7603613152168691,
    -0.8802041900344193,
    0.9152867561206222,
    -0.8569660419598222,
    0.7748217885382473,
    -0.6490827850066125,
    -0.09080499177798629,
    0.5104356775991619,
    -0.8282731734216213,
    -0.12264189077541232,
    -0.009982225950807333,
    0.2174927252344787,
    -0.17886552773416042,
    0.4550070553086698,
    0.8524289950728416,
    0.6421927032060921,
    0.8713407022878528,
    0.36852204659953713,
    0.5687664058059454,
    0.024882334284484386,
    0.8754940992221236,
    -0.5745028471574187,
    -0.6607649442739785,
    0.466771038249135,
    0.37881460785865784,
    0.4808510560542345,
    0.17529193498194218,
    -0.2622280749492347,
    -0.8524869573302567,
    -0.5595532190054655,
    0.8573764199391007,
    0.36262899870052934,
    -0.5905260755680501,
    -0.38599627232179046,
    0.4919377234764397,
    -0.02462127059698105,
    -0.9912418122403324,
    -0.9848848474211991,
    0.3350265580229461,
    0.79625113774091,
    0.6780760064721107,
    -0.42152600130066276,
    0.3016181127168238,
    -0.6456813705153763,
    0.3775218282826245,
    -0.8104111077263951,
    -0.9959049634635448,
    -0.2970150774344802,
    0.10297723580151796,
    0.9546182346530259,
    0.5696246274746954,
    0.9035652233287692,
    0.15376735851168633,
    -0.2911328203044832,
    -0.6461580414324999,
    0.40255018463358283,
    -0.4102671481668949,
    0.5995145211927593,
    -0.0013414579443633556,
    0.6517702001146972,
    -0.48188431560993195,
    -0.900435394141823,
    0.340845781378448,
    0.847764384932816,
    0.6030820775777102,
    -0.6026527709327638,
    0.8950277487747371,
    -0.25790918432176113,
    -0.6724177347496152,
    -0.448223770596087,
    0.03157539712265134,
    -0.5238462979905307,
    -0.32654706155881286,
    0.6706689512357116,
    0.5013244175352156,
    -0.5772093678824604,
    -0.9900538055226207,
    -0.07027762057259679,
    -0.29411943769082427,
    0.059610935393720865,
    -0.14035592880100012,
    -0.3552671354264021,
    0.4104243782348931,
    -0.8469014936126769,
    0.8442621626891196,
    -0.5944493059068918,
    0.39418533304706216,
    -0.0780179500579834,
    0.16958865197375417,
    -0.6484384061768651,
    -0.8112956886179745,
    -0.1413741991855204,
    0.7164011867716908,
    -0.8150834096595645,
    -0.8662165822461247,
    0.6269422587938607,
    0.9439263022504747,
    -0.050794235430657864,
    0.6807094891555607,
    -0.2601293418556452,
    0.6000614729709923,
    -0.4918014914728701,
    0.2935758763924241,
    0.30541098630055785,
    -0.03126100916415453,
    -0.5376816792413592,
    -0.4305163659155369,
    0.26750950375571847,
    -0.594950906932354,
    0.22668105643242598,
    0.36693318793550134,
    -0.47071466874331236,
    -0.009049543179571629,
    -0.4365109200589359,
    -0.9771505505777895,
    -0.11943378066644073,
    -0.6770208734087646,
    -0.31849244609475136,
    -0.39219180401414633,
    0.45799531880766153,
    0.36099585657939315,
    -0.7816564640961587,
    0.012538329232484102,
    0.4627817738801241,
    -0.5472413864918053,
    0.24535099742934108,
    0.643262485973537,
    -0.4601909313350916,
    -0.19785733008757234,
    -0.7463950454257429,
    0.09127919934689999,
    -0.7587942462414503,
    0.8747453982941806,
    0.2615917567163706,
    0.7965794568881392,
    0.7283517448231578,
    -0.13915612548589706,
    -0.8611380914226174,
    -0.03394275298342109,
    -0.6032997141592205,
    0.66362330224365,
    0.9749263064004481,
    0.46989574236795306,
    -0.12847852380946279,
    0.16689012153074145,
    0.17758292285725474,
    0.5976123567670584,
    -0.6354778413660824,
    -0.043670573737472296,
    0.39901937264949083,
    -0.9560902342200279,
    0.4760512439534068,
    -0.2181162373162806,
    -0.36305593280121684,
    0.8009130801074207,
    -0.9920687028206885,
    0.4181529260240495,
    0.8565911115147173,
    -0.5090430844575167,
    -0.3637738027609885,
    -0.012193123809993267,
    0.9497181787155569,
    0.2527353158220649,
    -0.07695418363437057,
    -0.6279853298328817,
    0.4739092467352748,
    -0.6527855317108333
  ],
  "vcir_path": "programs/add.vcir",
  "manifest": "manifest.json"
}
